date,cycle,subsystem,phase,net_score,prod_fixes,new_failure_modes,category_d_ratio,axis_b_lowest,notes
2026-06-03,1,Interactive Console (HTML) + Tooling,reflect,1,2,1,,,"F01-F03 from first broad-scan; reflect prompt now emits Cycle Summary Block, regression gained Verify/deploy notes, guard pins HTML prompt-behavior parity"
2026-06-03,1,Interactive Console (HTML) + Tooling,reflect,1,1,0,,,"F04 HTML-JS test harness (check-html.mjs) wired into Test Command + CI; F05 esc() escaping + fixed broken archive Copy-content onclick (real latent bug)"
2026-06-04,1,all (cycle synthesis),synthesis,2,2,0,33%,Guard / Test Coverage Quality (6.5),"Cycle 1 synthesis: overall 7.9/10; 0 regressions; lowest Axis B = Test Coverage Quality; no policy triggers (first measurement)"
2026-06-04,2,Tooling & Sync Infra + Interactive Console (HTML),reflect,0,0,0,,,"Cycle 2 (test-coverage priority): added tests/guard.test.mjs (F03 guard logic) + storageWarn assertion (F06), wired into Test Command + CI; Category D for Cycle-1 fixes now ~17% (under the 25% gate); INV-21, INV-22 added"
2026-06-04,2,Tooling & Sync Infra + Templates,reflect,0,0,0,,,"Roadmap R4 (/cycle-init), R5 (VERSION+CHANGELOG+sync-commands version report; INV-23), R10 (estimates.csv + /reflect calibration step) shipped at v1.0.0; R3 (FSA state-store convergence) stopped — browser-only, unverifiable headless"
2026-06-04,2,Tooling & Sync Infra,reflect,0,0,0,,,"Roadmap R6 (SessionStart context hook), R2 (metrics report renderer), R14 (added to roadmap) shipped at v1.1.0; both new tools have regression tests in Test Command + CI; render-metrics arg-parsing bug caught by its test pre-commit"
2026-06-04,2,Tooling & Sync Infra,reflect,0,0,0,,,"Roadmap R9 (executable invariant runner scripts/invariant-check.mjs) shipped at v1.2.0; runs command-style Verify fields (PASS/FAIL), prose as MANUAL; 12/12 runnable invariants pass on this repo; tests/invariant-check.test.mjs (INV-26)"
